<?xml version="1.0" encoding="utf-8"?>
<!-- Created with Liquid Technologies Online Tools 1.0 (https://www.liquid-technologies.com) -->
<xs:schema xmlns:xsi="http://www.w3.org/2001/XMLSchema-instance" attributeFormDefault="unqualified" elementFormDefault="qualified" xmlns:xs="http://www.w3.org/2001/XMLSchema">
  <xs:element name="tapes">
    <xs:complexType>
      <xs:sequence>
        <xs:element maxOccurs="unbounded" name="tape">
          <xs:complexType>
            <xs:sequence>
              <xs:element name="label" type="xs:string" />
              <xs:element name="name" type="xs:string" />
              <xs:element name="notes" type="xs:string" />
              <xs:element name="purpose" type="xs:string" />
              <xs:element name="filename" type="xs:string" />
              <xs:element name="urls">
                <xs:complexType>
                  <xs:sequence>
                    <xs:element maxOccurs="unbounded" name="url">
                      <xs:complexType>
                        <xs:simpleContent>
                          <xs:extension base="xs:string">
                            <xs:attribute name="preferred" type="xs:boolean" use="optional" />
                          </xs:extension>
                        </xs:simpleContent>
                      </xs:complexType>
                    </xs:element>
                  </xs:sequence>
                </xs:complexType>
              </xs:element>
            </xs:sequence>
            <xs:attribute name="id" type="xs:string" use="required" />
          </xs:complexType>
        </xs:element>
      </xs:sequence>
    </xs:complexType>
  </xs:element>
</xs:schema>
